title,source_name,url,published_at,sentiment_score
Binance Coin Price Prediction: BNB Could Reach $1K While One Utility Token Challenger Builds Momentum Under The Radar,Cryptopolitan,https://partner.cryptopolitan.com/bnb-could-reach-1k-while-one-utility-token-challenger-builds-momentum-under-the-radar/,2025-08-02 12:00:00+00:00,0.0
"BNB’s price cools off after ATH, but is $1K target still possible?",Ambcrypto.com,https://ambcrypto.com/bnb-cools-off-after-ath-but-is-1k-target-still-possible/,2025-07-31 21:00:47+00:00,-0.7643357515335083
CEA Industries stock soars 833% after announcing BNB treasury plans,Techpinions.com,https://techpinions.com/cea-industries-stock-soars-833-after-announcing-bnb-treasury-plans/,2025-07-30 12:43:00+00:00,0.9177335500717163
Massive Accumulation Spur BNB To All-Time High as Market Cap Tapped $163 Billion,ZyCrypto,https://zycrypto.com/massive-accumulation-spur-bnb-to-all-time-high-as-market-cap-tapped-163-billion/,2025-07-29 20:26:57+00:00,0.0
CEA Industries Launches BNB Treasury,Yahoo Entertainment,https://consent.yahoo.com/v2/collectConsent?sessionId=1_cc-session_c9f2c1bf-cb6a-4407-ac32-cfe2a7206ae5,2025-07-29 18:59:40+00:00,0.0
CEA Industries Builds the Largest BNB Treasury After $1.7B Investment: What Crypto to Buy,Bitcoinist,https://bitcoinist.com/best-crypto-to-buy-as-company-aims-for-biggest-bnb-treasury-worldwide/,2025-07-29 12:04:51+00:00,0.8943391442298889
