title,source_name,url,published_at,sentiment_score
Insider fuels Nebraska hype train with bold CFP take,ClutchPoints,https://clutchpoints.com/ncaa-football/nebraska-football-news-cornhuskers-cfp-take,2025-08-05 00:00:17+00:00,0.0
"Hims & Hers Q2 revenue drop shakes stock—Hims crashes 11% after first-ever revenue decline, is the weight-loss drug hype finally fading?",The Times of India,https://economictimes.indiatimes.com/news/international/us/hims-hers-q2-revenue-drop-shakes-stockhims-crashes-11-after-first-ever-revenue-decline-is-the-weight-loss-drug-hype-finally-fading/articleshow/123104386.cms,2025-08-04 21:50:17+00:00,-0.9723044037818909
Hyperliquid records its highest-ever monthly trade volume in July,Biztoc.com,https://biztoc.com/x/143f6389a0488c5b,2025-08-04 19:41:57+00:00,0.0
Apu Apustaja Breaks New Ground with Native Token Listing on Hyperliquid,ZyCrypto,https://zycrypto.com/apu-apustaja-breaks-new-ground-with-native-token-listing-on-hyperliquid/,2025-08-04 19:30:44+00:00,0.0
"Shein hype dominates social media, but in Europe the firm's accused of greenwashing",ABC News (AU),https://www.abc.net.au/news/2025-08-05/france-and-italy-out-shein-amid-haul-culture/105612404,2025-08-04 19:08:58+00:00,0.0
When I Need to Be My Own Hype Girl,Incourage.me,https://www.incourage.me/2025/08/when-i-need-to-be-my-own-hype-girl.html,2025-08-04 06:20:28+00:00,0.0
LSU Football Tweets Then Deletes Hype Video Amid Criticism Referencing Brian Kelly’s Past,BroBible,https://brobible.com/sports/article/lsu-deletes-football-hype-video-brian-kelly-incident/,2025-08-03 18:03:57+00:00,-0.535179078578949
Canon EOS R5 Mark II: Worth the Hype or Just Another Upgrade?,Fstoppers,https://fstoppers.com/reviews/canon-eos-r5-mark-ii-worth-hype-or-just-another-upgrade-707981,2025-08-03 14:03:01+00:00,0.0
Hyperliquid slides below $38: THIS points toward $31 retest,Ambcrypto.com,https://ambcrypto.com/hyperliquid-slides-below-38-this-points-toward-31-retest/,2025-08-03 07:00:55+00:00,-0.968248188495636
