title,source_name,url,published_at,sentiment_score
Mill City Ventures to load up on more SUI with $500M deal as shares fall 11%,Cointelegraph,https://cointelegraph.com/news/mill-city-to-raise-500-million-for-sui-treasury,2025-08-02 04:47:57+00:00,-0.9703946709632874
SUI treasury firm Mill City shares drop as it eyes raising additional $500 million,Biztoc.com,https://biztoc.com/x/d64e5c80fb57adf0,2025-08-01 15:14:12+00:00,-0.7526736259460449
Short-term lender Mill City buys 76.3 million SUI after closing $450 million private placement,Biztoc.com,https://biztoc.com/x/356f5d58e886e6c3,2025-07-31 21:35:54+00:00,0.0
‘I Know What You Did Last Summer’ Star Chase Sui Wonders Recalls ‘Embarrassing Moment’ Quoting ‘Scooby-Doo’ to Freddie Prinze Jr. | Video,TheWrap,https://www.thewrap.com/chase-sui-wonders-scooby-doo-quote-freddie-prinze-jr-awkward/,2025-07-30 14:44:35+00:00,0.0
Nasdaq-listed Mill City Ventures earmarks $441M toward Sui treasury,Cointelegraph,https://cointelegraph.com/news/mill-city-ventures-announces-450m-sui-treasury-amid-sui-defi-surge,2025-07-29 04:36:14+00:00,0.72062087059021
