title,source_name,url,published_at,sentiment_score
Justin Sun Makes History as Youngest Chinese Commercial Astronaut with Blue Origin’s NS-34 Spaceflight,CryptoSlate,https://cryptoslate.com/justin-sun-makes-history-as-youngest-chinese-commercial-astronaut-with-blue-origins-ns-34-spaceflight/,2025-08-03 23:38:41+00:00,0.0
Justin Sun makes history as youngest Chinese commercial astronaut with Blue Origin’s NS-34 spaceflight,Crypto Briefing,https://cryptobriefing.com/justin-sun-spaceflight-blue-origin-2/,2025-08-03 22:26:00+00:00,0.0
Tron network founder Justin Sun returns from space,Cointelegraph,https://cointelegraph.com/news/tron-founder-justin-sun-returns-space,2025-08-03 20:51:46+00:00,0.0
"After Seeing Tron: Ares Footage At San Diego Comic-Con, I'm No Longer Worried About One Big Part Of The Movie",CinemaBlend,https://www.cinemablend.com/movies/after-seeing-tron-ares-footage-at-san-diego-comic-con-no-longer-worried-about-one-big-part-of-movie,2025-08-02 22:04:00+00:00,0.0
Things We Can’t Stand About Disney’s TRON Lightcycle Run,Inside the Magic,https://insidethemagic.net/2025/08/things-we-cant-stand-about-disneys-tron-lightcycle-run-ld1/,2025-08-02 14:00:13+00:00,0.0
Analyzing TRON’s 8.8% surge – TRX could hit new highs IF…,Ambcrypto.com,https://ambcrypto.com/analyzing-trons-8-8-surge-trx-could-hit-new-highs-if/,2025-08-02 13:00:15+00:00,0.8857458829879761
"TRON Recognized by CryptoRank, Messari, and Nansen: $916M Revenue and $81B USDT Supply in H1 2025",CryptoSlate,https://cryptoslate.com/tron-recognized-by-cryptorank-messari-and-nansen-916m-revenue-and-81b-usdt-supply-in-h1-2025/,2025-08-01 22:51:20+00:00,0.0
Car Deal of the Day: The award-winning Audi A6 e-tron for a cool price,AutoExpress,https://www.autoexpress.co.uk/audi/a6/367493/car-deal-day-award-winning-audi-a6-e-tron-cool-price,2025-08-01 16:11:32+00:00,0.0
"MEXC expands stock futures portfolio with Tron Inc. (NASDAQ: TRON) listing, introducing TRON/USDT trading pair",Crypto Briefing,https://cryptobriefing.com/tron-stock-futures-mexc-listing/,2025-08-01 12:26:33+00:00,0.0
"MEXC Expands Stock Futures Portfolio with Tron Inc. (NASDAQ: TRON) Listing, Introducing TRON/USDT Trading Pair",Cryptopolitan,https://partner.cryptopolitan.com/mexc-expands-stock-futures-portfolio-with-tron-inc-nasdaq-tron-listing-introducing-tron-usdt-trading-pair/,2025-08-01 10:05:37+00:00,0.8393177390098572
"MEXC Expands Stock Futures Portfolio with Tron Inc. (NASDAQ: TRON) Listing, Introducing TRON/USDT Trading Pair",CryptoSlate,https://cryptoslate.com/mexc-expands-stock-futures-portfolio-with-tron-inc-nasdaq-tron-listing-introducing-tron-usdt-trading-pair/,2025-08-01 10:00:51+00:00,0.0
Ram TRX Set to Return with V-8 Power and Brash Off-Road Prowess,HYPEBEAST,https://hypebeast.com/2025/8/2026-v8-ram-trx-release-info,2025-08-01 01:05:09+00:00,0.8685118556022644
2021 Ram 1500 TRX Crew Cab 4×4,Bringatrailer.com,https://bringatrailer.com/listing/2021-ram-1500-trx-87/,2025-07-31 23:30:07+00:00,0.0
TRON Inc. Plans $1B Buyback of 3.1B TRX Tokens Amid Price Resilience at $0.33,newsBTC,http://www.newsbtc.com/news/tron-inc-plans-1b-buyback-of-3-1b-trx-tokens-amid-price-resilience-at-0-33/,2025-07-31 15:25:46+00:00,0.9450536370277405
Neurocrine Biosciences Inc (NBIX) Q2 2025 Earnings Call Highlights: Strong Sales Growth and ...,Yahoo Entertainment,https://finance.yahoo.com/news/neurocrine-biosciences-inc-nbix-q2-073201446.html,2025-07-31 07:32:01+00:00,0.9524623155593872
Tron Inc. files for $1B shelf offering: Will TRX see another bullish run?,Ambcrypto.com,https://ambcrypto.com/tron-inc-files-for-1b-shelf-offering-will-trx-see-another-bullish-run/,2025-07-31 03:00:30+00:00,0.922541618347168
RAM 1500 TRX To Return In 2026 With More V8 Power,Forbes,https://www.forbes.com/sites/michaelharley/2025/07/30/ram-1500-trx-to-return-in-2026-with-more-v8-power/,2025-07-31 00:47:29+00:00,0.0
Why TRON Latest $1B USDT Mint May Be Its Most Strategic Yet,Bitcoinist,https://bitcoinist.com/tron-latest-1b-usdt-mint-may-be-its-most-strategic/,2025-07-29 22:30:55+00:00,0.7301096320152283
TRON mints $1B USDT after Nasdaq debut: Will this translate to gains?,Ambcrypto.com,https://ambcrypto.com/tron-mints-1b-usdt-after-nasdaq-debut-will-this-translate-to-gains/,2025-07-29 18:00:27+00:00,0.5641646981239319
Investors Buy High Volume of Call Options on Tron (NASDAQ:TRON),ETF Daily News,https://www.etfdailynews.com/2025/07/29/investors-buy-high-volume-of-call-options-on-tron-nasdaqtron/,2025-07-29 05:12:49+00:00,0.8607003092765808
