title,source_name,url,published_at,sentiment_score
XRP Price Crash Could Deepen As Bearish Formations Gather,Bitcoinist,https://bitcoinist.com/xrp-price-crash-could-deepen/,2025-08-04 06:00:56+00:00,-0.9634643793106079
"Below $3 again, XRP faces heavy pressure – But THIS level can flip the trend",Ambcrypto.com,https://ambcrypto.com/below-3-again-xrp-faces-heavy-pressure-but-this-level-can-flip-the-trend/,2025-08-03 21:00:50+00:00,-0.7768251299858093
XRP Gains Momentum As Analyst Calls It The ‘Smartest Crypto’ To Buy,Bitcoinist,https://bitcoinist.com/xrp-gains-momentum-as-analyst-calls-it-the-smartest-crypto-to-buy/,2025-08-03 15:30:06+00:00,0.4625018537044525
Pro-Ripple Analyst Shutdowns the “XRP Has No Utility” Argument,ZyCrypto,https://zycrypto.com/pro-ripple-analyst-shutdowns-the-xrp-has-no-utility-argument/,2025-08-03 15:04:20+00:00,-0.8374350070953369
Last Chance To Buy XRP Under $3? ‘XRP 2.0’ Remittix Blasts Past $18M In 2025’s Best Crypto Presale,Cryptopolitan,https://partner.cryptopolitan.com/last-chance-to-buy-xrp-under-3-xrp-2-0-remittix-blasts-past-18m-in-2025s-best-crypto-presale/,2025-08-03 11:45:23+00:00,-0.9590883851051331
"Ripple (XRP) Shows Weakness, Set to Sink as Investor Interest Shifts to New Utility Crypto Predicted to Move from $0.035 to $7",Cryptopolitan,https://partner.cryptopolitan.com/ripple-xrp-shows-weakness-set-to-sink-as-investor-interest-shifts-to-new-utility-crypto-predicted-to-move-from-0-035-to-7/,2025-08-03 10:30:00+00:00,-0.9682843089103699
Ripple [XRP] – Could THIS bearish pattern drive prices to $2.60?,Ambcrypto.com,https://ambcrypto.com/ripple-xrp-could-this-bearish-pattern-drive-prices-to-2-60/,2025-08-03 00:00:11+00:00,-0.9339219927787781
Ripple’s Strategic Reserve Plans Ignite XRP Bulls’ $6 Breakout Hopes as Social Buzz Explodes,ZyCrypto,https://zycrypto.com/ripples-strategic-reserve-plans-ignite-xrp-bulls-6-breakout-hopes-as-social-buzz-explodes/,2025-08-02 19:14:40+00:00,0.8859720826148987
"Trader Spots New Cheap XRP Alternative That Could Be Next to Deliver $100,000 from Just $1,000",Cryptopolitan,https://partner.cryptopolitan.com/trader-spots-new-cheap-xrp-alternative-that-could-be-next-to-deliver-100000-from-just-1000/,2025-08-02 18:50:00+00:00,0.8323625326156616
Ripple CTO Explains Why Bank Partnerships Haven’t Generated Billions in On-Chain Volume for XRP,ZyCrypto,https://zycrypto.com/ripple-cto-explains-why-bank-partnerships-havent-generated-billions-in-on-chain-volume-for-xrp/,2025-08-02 16:17:23+00:00,0.0
Here is XRP Price If Retirement Funds Allocate 1% to XRP,Biztoc.com,https://biztoc.com/x/2420c3acf8824430,2025-08-02 15:19:56+00:00,0.0
Analyst Forecasts Ripple’s XRP $6 Boom as Wallet Growth and Social Buzz Explode,ZyCrypto,https://zycrypto.com/analyst-forecasts-ripples-xrp-6-boom-as-wallet-growth-and-social-buzz-explode/,2025-08-01 21:20:59+00:00,0.9405390024185181
Potential impact of SEC’s Project Crypto on XRP and SOL prices,Ambcrypto.com,https://ambcrypto.com/potential-impact-of-secs-project-crypto-on-xrp-and-sol-prices/,2025-08-01 21:00:55+00:00,-0.9709779620170593
"Ripple (XRP) to Rally 800%, But This New Crypto Could Rise 4000% in the Next Bull Run",Cryptopolitan,https://partner.cryptopolitan.com/ripple-xrp-to-rally-800-but-this-new-crypto-could-rise-4000-in-the-next-bull-run/,2025-08-01 20:00:00+00:00,0.9423301815986633
Ripple Exec Reveals What Will Drive The XRP Price Value,newsBTC,http://www.newsbtc.com/analysis/xrp/ripple-exec-xrp-price-value/,2025-08-01 18:00:24+00:00,0.0
XRP’s ‘bullish divergence’ raises 20% price rally potential in August,Cointelegraph,https://cointelegraph.com/news/xrp-bullish-divergence-20-price-rally-potential-august,2025-08-01 17:21:45+00:00,0.8984291553497314
Will Ripple’s XRP Momentum Be Enough to Hit $10 by Year-End 2025?,ZyCrypto,https://zycrypto.com/will-ripples-xrp-momentum-be-enough-to-hit-10-by-year-end-2025/,2025-08-01 15:13:34+00:00,0.9447469115257263
Ripple CTO addresses XRP debate as Kraken eyes $15 billion IPO,Coinjournal.net,https://coinjournal.net/news/ripple-cto-addresses-xrp-debate-as-kraken-eyes-15-billion-ipo/,2025-08-01 13:07:47+00:00,-0.9571983814239502
XRP sell-off pushes price below $3 – Is the rally over?,Ambcrypto.com,https://ambcrypto.com/xrp-sell-off-pushes-price-below-3-is-the-rally-over/,2025-08-01 13:00:31+00:00,-0.95749831199646
XRP price forecast: XRP dips 7% as crypto downturn threatens bulls,Coinjournal.net,https://coinjournal.net/news/xrp-price-forecast-xrp-dips-7-as-crypto-downturn-threatens-bulls/,2025-08-01 11:41:45+00:00,-0.9725773334503174
Is XRP (Ripple) a Buy For Less Than $5?,Yahoo Entertainment,https://consent.yahoo.com/v2/collectConsent?sessionId=1_cc-session_a36789e3-8d24-4d63-bce0-820e2b869a5a,2025-08-01 11:10:00+00:00,0.0
