post_id,subreddit,title,score,created_utc,sentiment_score
1mklmtn,Chainlink,https://okx.com/join/73811222,0,2025-08-08 04:22:46+00:00,0.0
1mklgy4,Chainlink,How the Chainlink Reserve Could Trigger a LINK Supply Shock,26,2025-08-08 04:14:12+00:00,0.0
1mk02a0,Chainlink,Introducing the Chainlink Reserve: A Strategic LINK Token Reserve,154,2025-08-07 13:26:17+00:00,0.0
1mjs5yf,Chainlink,J.P. Morgan on Chainlink Ecosystem | Every Chainlink integration and partnership,66,2025-08-07 05:59:12+00:00,0.0
1mhry7d,Chainlink,I asked Super Grok about XCN vs XRP,0,2025-08-04 22:31:19+00:00,0.0
1mhk663,Chainlink,Chainlink Had Launched real-time data streams for U.S. Equities and ETFs for RWA Markets,153,2025-08-04 17:40:34+00:00,0.0
