post_id,subreddit,title,score,created_utc,sentiment_score
1mhsm3x,cardano,"Cardano: Las Vegas Governance Workshop Tuesday, August 5 Afternoon Session - Input Output",7,2025-08-04 22:58:50+00:00,0.0
1mhr0jv,cardano,Ascent Rivals Pool Party at Rare Evo!,13,2025-08-04 21:53:58+00:00,0.0
1mhp7ik,cardano,Cardano Card will onboard cross-chain users,87,2025-08-04 20:44:45+00:00,0.0
1mhjyi1,cardano,"Stop Losing Money: Slippage, Price Impact &amp; Fees Explained - Linda CryptoFly",10,2025-08-04 17:32:51+00:00,0.0
1mhh6er,cardano,European Cardano Community (ECC) Founder Tips (Playlist),20,2025-08-04 15:51:22+00:00,0.0
1mhgmox,cardano,Crypto x Sports x Environmental stewardship,6,2025-08-04 15:30:58+00:00,0.0
1mhdd7u,cardano,Cardano (ADA) Gets $71M Boost for Upgrades – ETF Approval Coming?,161,2025-08-04 13:25:02+00:00,0.9300112724304199
1mhbef8,cardano,🔑 Networking is KEY in Web3! #Cardano #crypto #shorts - Kaizen Crypto,6,2025-08-04 11:56:53+00:00,0.0
1mha0dd,cardano,How to make sure an abandoned project doesn't receive more Catalyst funding?,27,2025-08-04 10:42:41+00:00,0.0
1mha013,cardano,"How many nodes are running for cardano network, any setup running on linux?",13,2025-08-04 10:42:08+00:00,0.0
1mh7ifp,cardano,ImmortalADA decentralized liquid will protocol proposal!,20,2025-08-04 08:03:39+00:00,0.0
1mh7bg6,cardano,Governance Workstream Consortium Info Action - The SWARM,9,2025-08-04 07:50:56+00:00,0.0
1mh43ge,cardano,Is this the correct snek in yoroi wallet ?,14,2025-08-04 04:33:54+00:00,0.0
1mgok7a,cardano,How do we onboard NEW users to crypto? - Late Game Crypto with Josh Noriega,23,2025-08-03 17:08:51+00:00,0.0
1mgdpha,cardano,I know Charles doesn't use his Ada to vote directly. But to who is he delegated or did he choose abstain?,34,2025-08-03 08:00:48+00:00,0.0
1mg86in,cardano,Updated F13 Sustain &amp; Maintain Gimbalabs Close-out Video - Gimbalabs,12,2025-08-03 02:36:54+00:00,0.0
1mg28fo,cardano,Cardano News: WTF IS HAPPENING?! 🇺🇸 | Wins of the Week #35 - cattle daddy media,28,2025-08-02 21:46:54+00:00,0.0
1mg1tpv,cardano,RareEvo Suggestions,37,2025-08-02 21:28:56+00:00,0.0
1mfzy1m,cardano,Interview w/ President of Midnight Foundation - big pey,29,2025-08-02 20:07:27+00:00,0.0
1mfvnev,cardano,How I built a Cardano Cold Wallet Generator (Technical Overview),21,2025-08-02 17:05:14+00:00,0.0
