post_id,subreddit,title,score,created_utc,sentiment_score
1mijpc6,Avax,Avalanche Ecosystem — July Recap 🔺,7,2025-08-05 20:02:19+00:00,0.7886903882026672
1miisjl,Avax,This is a social experiment - PF,0,2025-08-05 19:28:10+00:00,0.0
1mif569,Avax,Round 2 of the Avalanche Ecosystem Showdown just started,13,2025-08-05 17:15:21+00:00,0.0
1mi8oc7,Avax,The Sports Loyalty Revolution That Generated $5 Million in Partner Sales on Avalanche | Avax Architects Series by CoinDesk,5,2025-08-05 13:05:43+00:00,0.0
1mi7tv4,Avax,CFTC launching 'Crypto Sprint' to acelerate crypto adoption in the U.S with AVAX co-founder as member of the Tech Advisory committee,20,2025-08-05 12:28:42+00:00,0.0
1mi4iyx,Avax,"OK - I get it, it's rough.  But $AVAX Gambia just rugged last night?",3,2025-08-05 09:28:03+00:00,0.0
1mhsv98,Avax,Everything you need to know about AvaCloud 🔺,2,2025-08-04 23:09:45+00:00,0.0
1mhjbow,Avax,Did you know you can use BTC on Avalanche?,13,2025-08-04 17:10:16+00:00,0.0
1mhdaxx,Avax,"Every Major Financial Institution Will Be Onchain Sooner Than You Think, and Avalanche Will Be Their Playground",45,2025-08-04 13:22:23+00:00,0.0
1mhd76r,Avax,"Lost $47,300 in AVAX liquidation after suspicious wick – asking Ava Labs for support, no response in 1+ month""",0,2025-08-04 13:17:53+00:00,0.0
1mh5e28,Avax,"AVALANCHE
The Chain of Chains — Built to Scale Everything.",10,2025-08-04 05:48:42+00:00,0.0
1mgmi9u,Avax,🔁Core just got a full upgrade (Web &amp; Mobile).,24,2025-08-03 15:45:01+00:00,0.0
1mgetvd,Avax,"Launch a Layer 1 Blockchain in Hours, Not Months using AvaCloud powered by Avalanche",10,2025-08-03 09:15:57+00:00,0.0
1mgesdq,Avax,"Launch a Layer 1 Blockchain in Hours, Not Months using AvaCloud powered by Avalanche",14,2025-08-03 09:13:15+00:00,0.0
1mgep3s,Avax,"Launch a Layer 1 Blockchain in Hours, Not Months Using AvaCloud Powered by Avalanche",4,2025-08-03 09:06:52+00:00,0.0
1mfw8q5,Avax,Turn your idle BTC into DeFi power ⚡️,9,2025-08-02 17:30:25+00:00,0.0
1mftvlh,Avax,"Why AVAX Is the Most Asymmetric Bet in Crypto, and Why $1,000 Is Just a Matter of Liquidity Flowing Home",75,2025-08-02 15:51:05+00:00,0.0
1mftqew,Avax,We have to talk about GERZACOIN.,0,2025-08-02 15:45:11+00:00,0.0
1mfpqly,Avax,We still good?,23,2025-08-02 12:48:40+00:00,0.0
