post_id,subreddit,title,score,created_utc,sentiment_score
1miqpi1,ethereum,blackrock just pulled $375m from their eth etf in the biggest single day withdrawal ever and honestly this might be good news,0,2025-08-06 00:49:07+00:00,-0.6162354946136475
1minspq,ethereum,Would anyone kindly Audit these two CAs from tokens I successfully created via my generator I created?,3,2025-08-05 22:42:34+00:00,0.0
1mil7kt,ethereum,PEEPanEIP-7939: Count Leading Zeros (CLZ) Opcode with Vectorized,5,2025-08-05 20:59:12+00:00,0.8383277058601379
1miget7,ethereum,How is based sequencing going?,3,2025-08-05 18:00:58+00:00,0.0
1mi9rcj,ethereum,ETH staking trends beyond a price point? Who gets pushed out over time?,13,2025-08-05 13:51:01+00:00,0.0
1mi09a5,ethereum,"Daily General Discussion August 05, 2025",55,2025-08-05 05:00:59+00:00,0.0
1mhub69,ethereum,Where to swap Bitcoin for Ethereum without risk?,75,2025-08-05 00:12:49+00:00,0.0
1mhsdui,ethereum,Finally took the leap into block chain development,18,2025-08-04 22:49:08+00:00,0.0
1mh4ldl,ethereum,"Daily General Discussion August 04, 2025",161,2025-08-04 05:01:46+00:00,0.0
1mguwwm,ethereum,SharpLink Gaming Buys $54M Ethereum as Total Treasury Reaches $1.65 Billion,74,2025-08-03 21:19:27+00:00,0.6776324510574341
1mgjfhw,ethereum,Is it possible to buy etherium without residence permit?,0,2025-08-03 13:35:57+00:00,0.0
1mgg6j3,ethereum,26 optimism transactions fees on June -why?,7,2025-08-03 10:43:19+00:00,0.0
1mgatfj,ethereum,"Daily General Discussion August 03, 2025",159,2025-08-03 05:00:30+00:00,0.0
1mg6zx1,ethereum,The perfect CAPTCHA: Bitpeople,0,2025-08-03 01:36:14+00:00,0.0
1mfyamv,ethereum,CNBC: Ethereum turns 10: From scrappy experiment to Wall Street’s invisible backbone,115,2025-08-02 18:56:42+00:00,0.0
1mfvxl4,ethereum,Posted by Blokiments - Leon (Not taking credit for whats written below just spreading the message) The entire app and testnet they created is fake.Whitenet Testnet,0,2025-08-02 17:17:19+00:00,0.0
1mftlo8,ethereum,What ways can you use to determine what hooks a v4 pool has?,7,2025-08-02 15:39:42+00:00,0.0
