post_id,subreddit,title,score,created_utc,sentiment_score
1mkgjtu,litecoin,Sheetz collab,23,2025-08-08 00:15:23+00:00,0.0
1mkaha3,litecoin,LTC for small business?,12,2025-08-07 20:04:58+00:00,0.0
1mk8ksl,litecoin,Litecoin LTC,90,2025-08-07 18:52:06+00:00,0.0
1mk4tvz,litecoin,Why do most exchanges show shitcoins before Litecoin even though it's doing better,30,2025-08-07 16:31:56+00:00,0.0
1mk07qm,litecoin,Good place to start?,30,2025-08-07 13:32:33+00:00,0.0
1mje19p,litecoin,day 450 snail posting until Wizards of the Blockchain release their new crypto memes deck ft LITECOIN SNAIL,54,2025-08-06 19:23:26+00:00,0.0
1mj495s,litecoin,THANK YOU FOR JINXING IT AGAIN BIG MOUTH INTERN. FIRE HIM NOW,78,2025-08-06 13:09:48+00:00,-0.677147626876831
1miz8tb,litecoin,Build the Economy you want with Litecoin,34,2025-08-06 08:37:53+00:00,0.0
1miwcg9,litecoin,Interview Charlie Lee &amp; Joshua Riezman,24,2025-08-06 05:34:26+00:00,0.0
1micr79,litecoin,Madagascar?,36,2025-08-05 15:46:07+00:00,0.0
1miboc3,litecoin,Hardware wallet for LTC,14,2025-08-05 15:04:28+00:00,0.0
1mi82jk,litecoin,"Mei Pharma has acquired 929,548 Litecoin",136,2025-08-05 12:39:48+00:00,0.0
1mi2oca,litecoin,Where my fellow liters?,15,2025-08-05 07:27:39+00:00,0.0
1mi2n5c,litecoin,I got a question about the tax laws in your countries,5,2025-08-05 07:25:36+00:00,0.0
1mi1rck,litecoin,Why this massive pump?,44,2025-08-05 06:29:49+00:00,0.0
1mhxopg,litecoin,Litecoin getting lots of Press,49,2025-08-05 02:48:18+00:00,0.0
1mhv3aq,litecoin,"Who is Zayn Kalyan from  Luxxfolio? No offens, but is he legit?",4,2025-08-05 00:48:09+00:00,0.0
1mhuii2,litecoin,What's the best Instant Exchange to buy Litecoin?,59,2025-08-05 00:21:59+00:00,0.0
1mhsv0n,litecoin,This is for Anyone that is thinking/wants to sell their LiteCoin,48,2025-08-04 23:09:28+00:00,0.0
1mhqloe,litecoin,Day 447 snail posting until satoshi swaps her bee tea sea for M Web fungi bull peer too peer electronic catch,26,2025-08-04 21:37:35+00:00,0.0
1mhqhrc,litecoin,Need 1 LTC TESTNET for a project,3,2025-08-04 21:33:29+00:00,0.0
1mho67b,litecoin,Is now a realistically good time to sell my Litecoin?,16,2025-08-04 20:05:54+00:00,0.0
1mhma9s,litecoin,Litecoin is more alive than ever!,129,2025-08-04 18:56:04+00:00,0.0
1mhi4kn,litecoin,Sucks,27,2025-08-04 16:26:18+00:00,-0.6435285806655884
1mhcaon,litecoin,Litecoin continues to rank high in payment usage in July! 💪,74,2025-08-04 12:39:07+00:00,0.8703771829605103
1mh6xm0,litecoin,"84 Litecoin is 1 in 1,000,000",52,2025-08-04 07:25:08+00:00,0.0
1mh4ppd,litecoin,When 1m in MWEB?,47,2025-08-04 05:08:52+00:00,0.0
1mgzb0e,litecoin,We trending on binance,34,2025-08-04 00:33:49+00:00,0.0
1mgxw62,litecoin,I Feel It Coming,70,2025-08-03 23:28:14+00:00,0.0
1mgxgoh,litecoin,111.11😳,162,2025-08-03 23:08:52+00:00,0.0
1mgo15g,litecoin,Mweb concerns,12,2025-08-03 16:47:32+00:00,0.0
1mgijuu,litecoin,"great moments in Litecoin history, Cher and Sunny mine the original transaction ledger by hand and pack the genesis blocks into their 1995 ecoline van",25,2025-08-03 12:55:03+00:00,0.0
1mgia49,litecoin,Litecoin/MWEB payment stats on our service,22,2025-08-03 12:41:35+00:00,0.0
1mgdwsb,litecoin,Scarcity Matters,32,2025-08-03 08:14:03+00:00,0.0
1mgcosc,litecoin,Litecoin Meta Unlocked,18,2025-08-03 06:55:18+00:00,0.0
1mg9jtw,litecoin,"Why Litecoin (LTC) Might Be the Next Big Flip — Not a Market Call, but a Psychological Setup",78,2025-08-03 03:49:44+00:00,0.0
1mg328k,litecoin,"The new deadline for the SEC decision on the Litecoin ETF is October 10, 2025???",46,2025-08-02 22:24:23+00:00,0.0
1mfw5xm,litecoin,THE GOAT,76,2025-08-02 17:27:07+00:00,0.0
